produto;precos;descontos;preco2;desconto
Calças femininas/calça alfaiataria/ calça básica / calça elegante/ calça skinny/ calça blogueira/calça da moda;R$34,56;-65%;R$34.56;
Kimono Cardigan Feminino Longo Aberto Estiloso;R$10,00;-67%;R$10.00;
Camisetas Lindas T-shirts Estampadas Femininas Blusas;R$20,90;-74%;R$20.90;
Blusa Tricô Feminina Manga Longa Suéter Inverno Tendencia Moda !!;R$26,49;-74%;R$26.49;
Body Feminino Decote Quadrado Manga Longa;R$29,90;-73%;R$29.90;
Short Za com Cinto Feminino de Alfaiataria;R$29,84;-48%;R$29.84;
Meia-Calça Térmica Forrada Peluciada Translúcida de Lã Legging Grossa Inverno Quente Feminina;R$31,41;-43%;R$31.41;
Short Bíquini Sunkini Short com Ajustes nas Laterais Amarrar Praia Piscina;R$19,99;-7%;R$19.99;
Blusa t-shirt básica elegante gola ribana;R$23,44;-20%;R$23.44;
Roupas de Férias para Mulheres, Vestido Midi Geométrico Sem Mangas para Roupas de Verão, Vestidos Diários para Mulheres no Verão;R$53,59;-50%;R$53.59;
Blusa básica premium 100% algodão plus-size;R$27,12;-20%;R$27.12;
SHEIN Privé Camisole feminina com alças estilo halter e detalhes contrastantes;R$30,32;-20%;R$30.32;
SHEIN LUNE Regata Tie Dye Feminina Estampa de Árvore e Lua, Decote Redondo, Roupa Casual de Verão (Estampa Aleatória), Camisetas Gráficas Femininas;R$39,16;-55%;R$39.16;
Coletinho Curto Feminino Forrado Alfaiataria C/ Botões Social Decote V;R$35,80;-79%;R$35.80;
Tendencia Blusinha T-Shirt Blusa Basica Com Listras;R$20,99;-57%;R$20.99;
SHORTS LEGGING FEMININO DE SUPLEX PRETO CINZA CINTURA ALTA NÃO TRANSPARENTE FITNESS ACADEMIA P M G E GG;R$15,19;-20%;R$15.19;
Luneh Blusa Casual Sem Mangas de Cor Sólida para Escritório, Verão, Tops Sem Mangas;R$42,39;-46%;R$42.39;
Blusa Trico Basica De Frio Feminina Decote V Manga Longa;R$31,90;-20%;R$31.90;
SHEIN LUNE Camiseta Feminina Ajustada com Gola V, Manga Raglan e Padrão Minimalista de Coração, Adequada para o Verão;R$39,99;-46%;R$39.99;
Blusa Cacharrel Feminina Lã Trico Tricot Gola Alta Atacado;R$31,90;-74%;R$31.90;
Camiseta Feminina Blusinha 100% Algodão Com Estampa Onça Once Animal Print Fashion;R$20,90;-20%;R$20.90;
INAWLY Camiseta Preta Macia e da Moda Feminina com Laço Brilhante e Estampa Floral em Relevo;R$45,56;-20%;R$45.56;
INAWLY Camisa Feminina de Colarinho Recortado com Listras Verticais, Blusas de Manga Longa;R$59,99;-52%;R$59.99;
trico garrafinho;R$12,08;-20%;R$12.08;
INAWLY Top sem mangas feminino com costas abertas, cor sólida e alças largas;R$39,92;-61%;R$39.92;
Blusa Térmica Frio Segunda Pele Manga Longa Forro Peluciado Inverno;R$34,99;-20%;R$34.99;
SHEIN LUNE Camiseta Gráfica Feminina com Impressão Listrada e Bloco de Cores;R$55,16;-7%;R$55.16;
Blusa T-shirt manga curta gola alta;R$23,44;-20%;R$23.44;
Breezaya Top sem Ombros Listrado com Barra Babada, Estilo de Verão para Mulheres;R$51,19;-20%;R$51.19;
INAWLY Camiseta Feminina Gráfica com Gola Padre e Estampa de Libélula;R$39,12;-20%;R$39.12;
Camiseta Casual e Versátil com Estampa de Limão, Cor Sólida, Oversized de Manga Curta, Verão;R$51,92;-90%;R$51.92;
