Produto;Preco;Desconto
Kimono Cardigan Feminino Longo Aberto Estiloso;10.0;
Meia-Calça Térmica Forrada Peluciada Translúcida de Lã Legging Grossa Inverno Quente Feminina;31.41;
Calças femininas/calça alfaiataria/ calça básica / calça elegante/ calça skinny/ calça blogueira/calça da moda;34.21;
Camiseta Feminina Los Angeles 91 Streetwear T-shirt Camisa Blogueira Style;22.45;
INAWLY Camisa Casual de Manga Longa, Estampada em Bloco de Cores, com Gola Única, Uso Diário, Blusas de Manga Longa;49.49;
Ripoll Blusa Térmica Manga Longa Feminina Peluciada Inverno;29.99;
SHEIN EZwear 2 Peças de Blusas de Verão Pretas e Brancas, Ombros Assimétricos com Franzido Lateral, Cropped, Blusas Femininas Casuais com Franzido Assimétrico no Pescoço, Ajuste Slim, Preto e Branco Liso, Primavera/Verão, Uso Diário Casual;49.49;
Body Feminino Segunda Pele Básico Gola Alta Manga Longa Moda Blogueira;22.0;
Luneh Vestido casual Halterneck spaghetti tie dye para verão, ideal para as férias;52.46;
Camiseta Feminina Blusinha 100% Algodão Com Estampa Onça Once Animal Print Fashion;20.69;
Breezaya Top Tanque Feminino Com Pescoço Redondo, Aplicação Floral Em Patchwork;39.71;
Blusa Tricô Feminina Manga Longa Suéter Inverno Tendencia Moda !!;26.49;
EMERY ROSE Camisa Feminina Vintage de Ajuste Solto, Ombros de Fora para Férias, Estampada, com Mangas Sino, Blusas de Manga Três Quartos;52.43;
SHEIN LUNE Calça longa casual feminina de cor sólida com cintura com laço e bolsos;72.71;
SHEIN LUNE Saia com Abertura Lateral e Estampa Floral Miúda para Roupas de Ano Novo, Traje Longo Feminino;49.49;
SHEIN LUNE Camiseta Gráfica Feminina com Impressão Listrada e Bloco de Cores;52.43;
SHEIN SXY Regata slim fit com botão metálico, estilo casual;50.18;
Body Feminino Gola Alta Manga Longa - SHEIN;29.9;
SHEIN LUNE Camisa de Manga Bufante com Impressão Floral e Renda Contrastante, Manga Curta, para Lazer e Férias, Blusas de Mulher;47.96;
SHEIN EZwear Regata Feminina Ajustada Casual com Estampa de Aranha, Adequada para o Verão;22.46;
Blusa T-shirt manga curta gola alta;23.44;
SHEIN LUNE Regata Feminina Estampa Colorblock Sem Mangas, Camisetas Gráficas, Blusas Femininas;38.96;
SHEIN LUNE Mulheres verão Cor sólida Botão decorado com mangas de morcego Casual Bubble Checkered Camiseta com capuz;56.21;
KARISMINA Regata tubular de malha impressa com ombros de fora e bainha assimétrica, para férias, para senhoras;27.74;
Breezaya Blusa impressão paisley traseira do buraco da fechadura pescoço de cabresto;37.49;
SHEIN Clasi Camisa de Manga Curta com Contraste de Cor Ajustada para Mulheres, Conjuntos de Verão para Mulheres, Looks de Professora para Mulheres, Camisas Brancas, Looks Country para Mulheres, Roupas de Verão para Mulheres;39.71;
INAWLY Regata Feminina Sem Mangas para Verão com Estampa de Asas de Anjo e Guitarra, Camisetas Femininas;41.24;
Blusa Cacharrel Feminina Segunda Pele Meia Estação;27.9;
ROMANTIC CROWN Meia-Calça Térmica Forrada Peluciada Translúcida De Lã Quente Feminina Para Inverno;28.99;
EgrlEra Top Sexy Transparente com Flores de Peônia e Bordado de Renda Elástica para Mulheres (Corte Aleatório);38.93;
INAWLY Camiseta Feminina Casual de Manga Curta com Gola Redonda e Estampa Floral e de Pássaro;38.96;
